42286feuille de bricksheet, brik66656503A008Z#F28.A07KPFine dough without yeast, ChillingA000JGrains and grain-based productsA04QTPasta, doughs and similar productsA008GRaw doughs and pre-mixes2044516pil pilble dur concasse complet (pil pil)grain, pil-pil666262941800A001N#F03.A06JC$F10.A06HR$F28.A0BA1$F28.A07KGCommon wheat grain, Fragments / granules / splinters,Integral /not refined,Cooking and similar thermal preparation processes,Drying (dehydration)A000JGrains and grain-based productsA000KCereals and cereal primary derivativesA000LCereal grains (and cereal-like grains)24509polentasemoule de maispolenta666262039903A00EP#F10.A166Y$F22.A07SS$F28.A07GLCorn semolina based thick soup, Home prepared (family, social networks, proxies),Fresh,BoilingA03VAComposite dishesA041KSoups and saladsA041LSoups (ready-to-eat)404695popcorn naturepop corn, plain18181811811810181005A00DC#F19.A07PRPopcorn (maize, popped), PlasticA000JGrains and grain-based productsA00CVBreakfast cerealsA04LKProcessed and mixed breakfast cereals336741984pate au sojavermicelle au sojasoya pasta666262940000A04LF#F04.A0DBM$F28.A0BA1Pasta-like products, Soyabeans and similar-,Cooking and similar thermal preparation processesA000JGrains and grain-based productsA04QTPasta, doughs and similar productsA007DPasta and similar products24701pate briseedough, short crust6665650603A008Y#F22.A07SH$F28.A07KPShort pastry dough (pate brisee), Food industry prepared,ChillingA000JGrains and grain-based productsA04QTPasta, doughs and similar productsA008GRaw doughs and pre-mixes101143752riz blanc rondriz special dessertrice, round666262031899A0F6M#F28.A07GL$F28.A07KGRice grain, glutinous, Boiling,Drying (dehydration)A000JGrains and grain-based productsA000KCereals and cereal primary derivativesA000LCereal grains (and cereal-like grains)11943755riz long et sauvage (melange)rice, mixed, long and wild666262031899A001G#F27.A001J$F27.A001F$F28.A07GL$F28.A07KGRice grain, mixed, Indian rice grain,Rice grain, long-grain,Boiling,Drying (dehydration)A000JGrains and grain-based productsA000KCereals and cereal primary derivativesA000LCereal grains (and cereal-like grains)1274507riz parfumeriz thai, riz basmatirice, flavoured666262040000A001D#F28.A07GPRice grain, SteamingA000JGrains and grain-based productsA000KCereals and cereal primary derivativesA000LCereal grains (and cereal-like grains)68842106riz sauvagerice, wild666262940000A001J#F28.A0BA1Indian rice grain, Cooking and similar thermal preparation processesA000JGrains and grain-based productsA000KCereals and cereal primary derivativesA000LCereal grains (and cereal-like grains)1443848semoule de ble dur (classique)graine de couscous (classique), semoule couscous (classique)semolina, wheat, dunum, regular666262971703A004F#F28.A07HD$F28.A07KPWheat semolina, Reheating,ChillingA000JGrains and grain-based productsA000KCereals and cereal primary derivativesA0ETLSemolina40543846semoule de ble dur n.s.semoule couscous n.s., graine de couscous n.s.semolina, wheat, dunum n.s.666262041899A004F#F28.A07GP$F28.A07KGWheat semolina, Steaming,Drying (dehydration)A000JGrains and grain-based productsA000KCereals and cereal primary derivativesA0ETLSemolina2645060semoule de kamutkhorasan wheat grain semolina666262401899A0ETL#F27.A001T$F28.A07GM$F28.A07KGSemolina, Khorasan wheat grain,Stewing,Drying (dehydration)A000JGrains and grain-based productsA000KCereals and cereal primary derivativesA0ETLSemolina234486vermicellecheveu d'angevermicellis66626240180699A008E#F22.A07SH$F28.A07GM$F28.A07KGGlass noodle, Food industry prepared,Stewing,Drying (dehydration)A000JGrains and grain-based productsA04QTPasta, doughs and similar productsA007DPasta and similar products2845054epeautrespelt grain6662620318A001R#F28.A07GL$F28.A07KGSpelt grain, Boiling,Drying (dehydration)A000JGrains and grain-based productsA000KCereals and cereal primary derivativesA000LCereal grains (and cereal-like grains)1662313topinambourartichaut de jerusalem, truffe du canada, poire de terreartichoke, jerusalem111010164401A00QQ#F03.A06JB$F21.A0C6S$F28.A07GQJerusalem artichokes, Dices / sticks,Back yard farming - growing,Pressure cookingA00FJVegetables and vegetable productsA00QFRoot and tuber vegetables (excluding starchy- and sugar-)A0DNVJerusalem artichokes and similar-9237galette de pommes de terrepomme de terre paillasson, pomme de terre croustine, rostipotatoes, wafers111111340602A011M#F22.A07SH$F28.A07GY$F28.A07KQRoesti, Food industry prepared,Roasting,FreezingA03VAComposite dishesA03VBDishes, incl. Ready to eat meals (excluding soups and salads)A03VCDishes excluding pasta or rice dishes, sandwiches and pizza)612310ignameyamyam111010060399A010D#F03.A06JG$F28.A07GLYams, Puree-type,BoilingA00ZRStarchy roots or tubers and products thereof, sugar plantsA00ZSStarchy roots and tubersA00ZYTropical root and tuber vegetables1
2311manioccassava111010160399A00ZZ#F03.A06JB$F28.A07GLCassava roots, Dices / sticks,BoilingA00ZRStarchy roots or tubers and products thereof, sugar plantsA00ZSStarchy roots and tubersA00ZYTropical root and tuber vegetables102312patate doucecamotepotato, sweet111010060499A010C#F03.A06JG$F28.A07GPSweet potatoes, Puree-type,SteamingA00ZRStarchy roots or tubers and products thereof, sugar plantsA00ZSStarchy roots and tubersA00ZYTropical root and tuber vegetables13231pomme de terrepatatepotatoes, normal111111069400009900A00ZT#F03.A06JG$F28.A0BA1Potatoes, Puree-type,Cooking and similar thermal preparation processesA00ZRStarchy roots or tubers and products thereof, sugar plantsA00ZSStarchy roots and tubersA0DPPPotatoes and similar-1596233638pomme de terre en quartierspotatoe, wedgepotatoes, wedges11111110060002A00ZT#F22.A07SH$F28.A07KV$F28.A07GV$F28.A07KQPotatoes, Food industry prepared,Slicing,Deep frying,FreezingA00ZRStarchy roots or tubers and products thereof, sugar plantsA00ZSStarchy roots and tubersA0DPPPotatoes and similar-57233639pomme de terre sauteepatate sautee, pomme de terre rissoleepotatoes, in cubes, fried1111110903010403A011Q#F17.A07MY$F20.A07QF$F22.A07SS$F26.A07XE$F28.A07GSPan-fried potato, Home prepared (family, social networks, proxies),Other,Outside light brown,W/o peel,Pan frying / shallow fryingA03VAComposite dishesA03VBDishes, incl. Ready to eat meals (excluding soups and salads)A03VCDishes excluding pasta or rice dishes, sandwiches and pizza)48723517tapiocaperle du japongrain, tapioca666262031899A00ZZ#F03.A0CQC$F28.A07GL$F28.A07KGCassava roots, Drops or similar small forms,Boiling,Drying (dehydration)A00ZRStarchy roots or tubers and products thereof, sugar plantsA00ZSStarchy roots and tubersA00ZYTropical root and tuber vegetables2234009tarochou caraibe, dachine, malanga, macabo, coboue, coboree, songe, songe, taniataro111010164099A010B#F03.A06JB$F28.A07GMTaros, Dices / sticks,StewingA00ZRStarchy roots or tubers and products thereof, sugar plantsA00ZSStarchy roots and tubersA00ZYTropical root and tuber vegetables1
2313topinambourartichaut de jerusalem, truffe du canada, poire de terreartichoke, jerusalem111010164401A00QQ#F03.A06JB$F21.A0C6S$F28.A07GQJerusalem artichokes, Dices / sticks,Back yard farming - growing,Pressure cookingA00FJVegetables and vegetable productsA00QFRoot and tuber vegetables (excluding starchy- and sugar-)A0DNVJerusalem artichokes and similar-9424040tofu a la provencalecooked tofu, provencal1717171171D8,A5050603A03TT#F04.A00HR$F04.A00HC$F19.A07PR$F22.A07SH$F28.A0CRH$F28.A07KPTofu, Food industry prepared,Globe tomato,Onions,Plastic,Seasoning,ChillingA03RQProducts for non-standard diets, food imitates and food supplementsA03TDMeat and dairy imitatesA0BXCDairy imitates182422800boulette de sojaboulette vegetalesoy, balls777676970503A03TF#F19.A07PR$F28.A07KY$F28.A07HD$F28.A07KPTextured soy protein, Plastic,Mincing / chopping / cutting,Reheating,ChillingA03RQProducts for non-standard diets, food imitates and food supplementsA03TDMeat and dairy imitatesA03TEMeat imitates1
426005chocolat chaud a base de boisson vegetaleplant-based milk imitate with chocolate555252020106A03TH#F04.A0EQD$F10.A077K$F22.A07SH$F26.A07XE$F28.A07MRMilk imitates, Food industry prepared,Other,Chocolate and similar,Without added sugar,Reconstitution from concentrate, powder or other dehydrated formA03RQProducts for non-standard diets, food imitates and food supplementsA03TDMeat and dairy imitatesA0BXCDairy imitates34422472escalope de sojaescalope vegetale, steak de soja, filet de soja, filet vegetalsoy, escalope7776764005,1003A03TF#F03.A06JA$F19.A07PR$F28.A07GM$F28.A07KPTextured soy protein, Slices, steaks or other flat cuts,Plastic,Stewing,ChillingA03RQProducts for non-standard diets, food imitates and food supplementsA03TDMeat and dairy imitatesA03TEMeat imitates13423096flan au sojaflan, soya555252009900A03TQ#F03.A0CEC$F04.A02PX$F04.A012FDairy imitates other than milks, Brittle jelly,Custard,Soyabeans (without pods)A03RQProducts for non-standard diets, food imitates and food supplementsA03TDMeat and dairy imitatesA0BXCDairy imitates2423289preparation infantile vegetale 2eme age a base de proteines de sojalait bebe de suite 2eme age au sojababy milk, second age, soya5552520206A03QS#F23.A07TH$F28.A07MRFollow-on formula, soya-based, liquid, Infant food, 3 - 6 months,Reconstitution from concentrate, powder or other dehydrated formA03PVFood products for young populationA03PYInfant and follow-on formulaeA0EQLFollow-on formulae3
426009preparation infantile vegetale et farine infantileinfant plant-based milk imitate with infant flour55515151051002A03PY#F04.A03TH$F04.A03QY$F28.A07MRInfant and follow-on formulae, Milk imitates,Simple cereals which have to be reconstituted with milk or other appropriate nutritious liquids,Reconstitution from concentrate, powder or other dehydrated formA03PVFood products for young populationA03PYInfant and follow-on formulae184423460nugget de sojanugget vegetalsoy, nuggets777676090503A03TF#F19.A07PR$F26.A07XE$F28.A07HK$F28.A07GS$F28.A07KPTextured soy protein, Other,Plastic,Breading,Pan frying / shallow frying,ChillingA03RQProducts for non-standard diets, food imitates and food supplementsA03TDMeat and dairy imitatesA03TEMeat imitates1
423593plat cuisine a base de soja n.s.cooked soy n.s.1717171171V9,M2,K3,W7,A5,G1,96,A600A03VM#F04.A0DCH$F04.A00JR$F04.A00QH$F04.A00JA$F04.A00HC$F04.A00JD$F04.A00GZ$F04.A01ABLegumes based dishes, Soyabeans for consumption (dry),Courgettes,Carrots,Sweet peppers,Onions,Aubergines,Garlic,Ginger rootsA03VAComposite dishesA03VBDishes, incl. Ready to eat meals (excluding soups and salads)A03VCDishes excluding pasta or rice dishes, sandwiches and pizza)4421983saucisse de sojasaucisse vegetalesoy, sausage777676980000A03TF#F24.A07VP$F26.A07XETextured soy protein, Ready-to-eat,OtherA03RQProducts for non-standard diets, food imitates and food supplementsA03TDMeat and dairy imitatesA03TEMeat imitates242212dessert vegetal a boire au sojasoya drink555252010799A03TJ#F04.A0EQD$F18.A07NZ$F19.A07PVSoya drink, Chocolate and similar,Flexible formed container,Laminated paperboard-plastic-metalA03RQProducts for non-standard diets, food imitates and food supplementsA03TDMeat and dairy imitatesA0BXCDairy imitates13422184steak hache de sojahache de soja, hache vegetal, hamburger de soja (sans pain), steak hache vegetalsoy, minced steak777676090599A03TF#F19.A07PR$F26.A07XE$F28.A07KY$F28.A07GSTextured soy protein, Other,Plastic,Mincing / chopping / cutting,Pan frying / shallow fryingA03RQProducts for non-standard diets, food imitates and food supplementsA03TDMeat and dairy imitatesA03TEMeat imitates3422118tofufromage de sojatofu777676980000A03TT#F24.A07VPTofu, Ready-to-eatA03RQProducts for non-standard diets, food imitates and food supplementsA03TDMeat and dairy imitatesA0BXCDairy imitates14424040tofu a la provencalecooked tofu, provencal1717171171D8,A5050603A03TT#F04.A00HR$F04.A00HC$F19.A07PR$F22.A07SH$F28.A0CRH$F28.A07KPTofu, Food industry prepared,Globe tomato,Onions,Plastic,Seasoning,ChillingA03RQProducts for non-standard diets, food imitates and food supplementsA03TDMeat and dairy imitatesA0BXCDairy imitates182