3597muesli n.s.muesli n.s.66646464164115,49,58,85A00EL#F04.A033J$F04.A01LC$F04.A0DRG$F04.A019VMuesli mixed, Honey,Cavendishes,Kiwi fruits and similar-,Cinnamon barkA000JGrains and grain-based productsA00CVBreakfast cerealsA00EJMuesli and similar4232579barre de cereales au chocolat type barre chocapicbarre chocapic (barre chocolatee), barre nesquik (barre chocolatee)cereal bar, chocolate coated like chocapic bar12121221221221122101020105A00EZ#F04.A0EQD$F10.A077A$F10.A077J$F19.A07PRCereal bars plain, Chocolate and similar,Full fat,With added sugar,PlasticA000JGrains and grain-based productsA00CVBreakfast cerealsA00EYCereal bars7832580barre de cereales au lait type barre frostiesbarre frostiescereal bar, chocolate coated like frosties121212212212211221CA040505A00EZ#F04.A02PG$F10.A077C$F10.A077M$F19.A07PRCereal bars plain, Condensed milk (sometimes with added sugars),Low fat (naturally or reduced),Low / Reduced sugar,PlasticA000JGrains and grain-based productsA00CVBreakfast cerealsA00EYCereal bars631224barre de cereales fourreecereal bar, filled121212212212211221020105A00FA#F10.A077A$F10.A077J$F19.A07PR$F28.A07MACereal bars mixed, Full fat,With added sugar,Plastic,FillingA000JGrains and grain-based productsA00CVBreakfast cerealsA00EYCereal bars931217barre de cereales type granygrany (barre de cereales)cereal bar like grany12121221221221122143,44,46030105A00FA#F04.A014L$F04.A014R$F04.A014H$F08.A046M$F10.A077A$F19.A07PRCereal bars mixed, Hazelnuts,Walnuts,Cashew nuts,Artificial sweeteners (e.g., aspartam, saccharine),Full fat,PlasticA000JGrains and grain-based productsA00CVBreakfast cerealsA00EYCereal bars7432875cereale au caramelbreakfast cereals, caramel66646464464403A00CV#F04.A06LRBreakfast cereals, Caramel flavourA000JGrains and grain-based productsA00CVBreakfast cereals1432866cereale au chocolat type crunchcrunch (cereale petit dejeuner)breakfast cereals like crunch66646464464401A0F4Q#F04.A0EQDExtruded breakfast cereal products, Chocolate and similarA000JGrains and grain-based productsA00CVBreakfast cerealsA04LKProcessed and mixed breakfast cereals57
3620cereale au chocolat type nesquiknesquik (cereale petit dejeuner)breakfast cereals like nesquik66646464464401A0F4Q#F04.A0EQDExtruded breakfast cereal products, Chocolate and similarA000JGrains and grain-based productsA00CVBreakfast cerealsA04LKProcessed and mixed breakfast cereals89
3623cereale au chocolat type weetosweetos (cereale petit dejeuner)breakfast cereals like weetos66646464464401A0F4Q#F27.A001MExtruded breakfast cereal products, Wheat and similar-A000JGrains and grain-based productsA00CVBreakfast cerealsA04LKProcessed and mixed breakfast cereals1
32874cereale au mielbreakfast cereals, honey66646464464415A00CV#F04.A033JBreakfast cereals, HoneyA000JGrains and grain-based productsA00CVBreakfast cereals17
3610cereale au miel type cheerioscheerios (cereale petit dejeuner)breakfast cereals like cheerios66646464464415A0F4Q#F04.A033J$F27.A000GExtruded breakfast cereal products, Honey,Oat grainA000JGrains and grain-based productsA00CVBreakfast cerealsA04LKProcessed and mixed breakfast cereals8
3616cereale au miel type golden grahamsgolden graham's (cereale petit dejeuner)breakfast cereals like golden graham's66646464464415A0F4Q#F04.A033J$F27.A001MExtruded breakfast cereal products, Honey,Wheat and similar-A000JGrains and grain-based productsA00CVBreakfast cerealsA04LKProcessed and mixed breakfast cereals20
32871cereale ble souffle au caramel type smackssmacks (cereale petit dejeuner)breakfast cereals, wheat, puffed, caramel like sma66646464464403A00EE#F04.A06LRWheat, popped, Caramel flavourA000JGrains and grain-based productsA00CVBreakfast cerealsA04LKProcessed and mixed breakfast cereals18
32876cereale chocolat et caramel type lionlion (cereale petit dejeuner)breakfast cereals, chocolate and caramel like lion66646464464403,01A00CV#F04.A06LR$F04.A0EQDBreakfast cereals, Caramel flavour,Chocolate and similarA000JGrains and grain-based productsA00CVBreakfast cereals138
3591cereale cornflakescornflakescorn flakes plain like original cornflakes666464640640A00DDProcessed maize-based flakesA000JGrains and grain-based productsA00CVBreakfast cerealsA04LKProcessed and mixed breakfast cereals118
32430cereale fourree type tresortresor (cereale petit dejeuner), chokella (cereale petit dejeuner)breakfast cereals, filled666464644644A0F4Q#F04.A0EQD$F28.A07MAExtruded breakfast cereal products, Chocolate and similar,FillingA000JGrains and grain-based productsA00CVBreakfast cerealsA04LKProcessed and mixed breakfast cereals27732872cereale mais souffle au miel type mielpopsmielpops (cereale petit dejeuner)breakfast cereals, corn, puffed, honey like mielpo66646464464415A00DC#F04.A033JPopcorn (maize, popped), HoneyA000JGrains and grain-based productsA00CVBreakfast cerealsA04LKProcessed and mixed breakfast cereals130
3587cereale petit dejeuner n.s.breakfast cereals n.s.66646464064017A00CV#F04.A000GBreakfast cereals, Oat grainA000JGrains and grain-based productsA00CVBreakfast cereals4132869cereale petales de ble au chocolat type chocapicchocapic (cereale petit dejeuner), chocos (cereale petit dejeuner)breakfast cereals, petals, wheat, chocolate like c66646464464401A0F4Q#F04.A0EQD$F27.A001MExtruded breakfast cereal products, Chocolate and similar,Wheat and similar-A000JGrains and grain-based productsA00CVBreakfast cerealsA04LKProcessed and mixed breakfast cereals203
32858cereale petales de ble complet type clustersclusters (cereale petit dejeuner)breakfast cereals, petals, whole wheat, like clust66646464064045A00EF#F04.A014D$F10.A06HRProcessed wheat-based flakes, Almonds,Integral /not refinedA000JGrains and grain-based productsA00CVBreakfast cerealsA04LKProcessed and mixed breakfast cereals1232865cereale petales de cereales completes type special kspecial k (cereale petit dejeuner), fitness (cereale petit dejeuner), cereale ligne et formepetals, whole riz and wheat6664646436434F,44A00EM#F04.A0EQD$F04.A014R$F10.A06HRProcessed mixed cereal-based flakes, Chocolate and similar,Walnuts,Integral /not refinedA000JGrains and grain-based productsA00CVBreakfast cerealsA04LKProcessed and mixed breakfast cereals12132868cereale petales de mais au chocolatcornflakes, chocolate66646464464401A00DD#F04.A0EQDProcessed maize-based flakes, Chocolate and similarA000JGrains and grain-based productsA00CVBreakfast cerealsA04LKProcessed and mixed breakfast cereals5
32867cereale petales de mais glaces sucrees type frostiesfrosties (cereale petit dejeuner)cornflakes, frozen with sugar like frosties666464644644A00EF#F28.A07HNProcessed wheat-based flakes, Sugar coatingA000JGrains and grain-based productsA00CVBreakfast cerealsA04LKProcessed and mixed breakfast cereals74
32861cereale riches en fibres n.s.high fiber cereals n.s.66646464264299A04LH#F26.A07XEBreakfast cereals, plain, OtherA000JGrains and grain-based productsA00CVBreakfast cerealsA04LHBreakfast cereals, plain1
32870cereale riz souffle au chocolat type cocopopscocopops (cereale petit dejeuner)breakfast cereals, rice, puffed, chocolate like co66646464464401A00DR#F04.A0EQDRice, popped, Chocolate and similarA000JGrains and grain-based productsA00CVBreakfast cerealsA04LKProcessed and mixed breakfast cereals118
3604cereale riz souffle sucre type rice krispiesrice krispies (cereale petit dejeuner)breakfast cereals like rice crispies666464644644A00DR#F10.A077JRice, popped, With added sugarA000JGrains and grain-based productsA00CVBreakfast cerealsA04LKProcessed and mixed breakfast cereals10
3609cereale type all branall bran (cereale petit dejeuner)all-bran66646464264200A00EDWheat bran rolled flakesA000JGrains and grain-based productsA00CVBreakfast cerealsA04LHBreakfast cereals, plain23615cereale type all bran fruit'n fibresall bran fruit'n fibre (cereale petit dejeuner)fruit and fibre66646464264243,67,25,49A00EF#F04.A01MA$F04.A014L$F04.A01ME$F04.A014K$F04.A01LCProcessed wheat-based flakes, Dried fruit,Hazelnuts,Dried vine fruits (raisins etc.),Coconuts,CavendishesA000JGrains and grain-based productsA00CVBreakfast cerealsA04LKProcessed and mixed breakfast cereals932863cereale type fitness pepitesfitness pepites (cereale petit dejeuner)breakfast cereals fitness, pepites6664646436434FA04QY#F04.A0EQDCereal flakes and similar, Chocolate and similarA000JGrains and grain-based productsA00CVBreakfast cerealsA04LKProcessed and mixed breakfast cereals632860cereale type jordan duojordan duo (cereale petit dejeuner)cereals, jordan duo66646464264243,B2A00EH#F04.A014L$F04.A014NMixed cereal rolled grains, Hazelnuts,PecansA000JGrains and grain-based productsA00CVBreakfast cerealsA04LHBreakfast cereals, plain1
32859cereale type plus fibresplus, fiber66646464264267,25,47,49A00ED#F04.A01ME$F04.A014K$F04.A01DJ$F04.A01LCWheat bran rolled flakes, Dried vine fruits (raisins etc.),Coconuts,Apples,CavendishesA000JGrains and grain-based productsA00CVBreakfast cerealsA04LHBreakfast cereals, plain1
32862cereale type special k pepitesspecial k pepites (cereale petit dejeuner)breakfast cereals special k, pepites6664646436434FA00EH#F04.A0EQDMixed cereal rolled grains, Chocolate and similarA000JGrains and grain-based productsA00CVBreakfast cerealsA04LHBreakfast cereals, plain483622cereale type weetabixweetabix (cereale petit dejeuner)weetabix66646464264299A00FA#F04.A001M$F04.A000P$F04.A032HCereal bars mixed, Wheat and similar-,Barley grains,Sucrose (common sugar)A000JGrains and grain-based productsA00CVBreakfast cerealsA00EYCereal bars263465flocon d'avoinequakers oatsflakes, oat666161A00DNProcessed oat-based flakesA000JGrains and grain-based productsA00CVBreakfast cerealsA04LKProcessed and mixed breakfast cereals55
35052flocon d'epeautrespelt flakes666161A04QY#F27.A001RCereal flakes and similar, Spelt grainA000JGrains and grain-based productsA00CVBreakfast cerealsA04LKProcessed and mixed breakfast cereals73601muesli croustillant type crunchycountry crisp (cereale petit dejeuner), extra pepites (cereale petit dejeuner), crunchy (cereale petit dejeuner), cruesli (cereale petit dejeuner)muesli, crunchy66646464164144A00EL#F04.A014RMuesli mixed, WalnutsA000JGrains and grain-based productsA00CVBreakfast cerealsA00EJMuesli and similar14033432muesli floconneux type special mueslicountry store (muesli)muesli,flaky66646464164167,55,17,M1A00EL#F04.A01ME$F04.A01HG$F04.A000G$F04.A00KP$F28.A07LGMuesli mixed, Dried vine fruits (raisins etc.),Figs,Oat grain,Sweet corn,FlakingA000JGrains and grain-based productsA00CVBreakfast cerealsA00EJMuesli and similar1033597muesli n.s.muesli n.s.66646464164115,49,58,85A00EL#F04.A033J$F04.A01LC$F04.A0DRG$F04.A019VMuesli mixed, Honey,Cavendishes,Kiwi fruits and similar-,Cinnamon barkA000JGrains and grain-based productsA00CVBreakfast cerealsA00EJMuesli and similar42